### ANY PACKETS CAPTURED WILL BE DUMPED HERE ###Loopback / IP / TCP 127.0.0.1:51242 > 127.0.0.1:51248 A
Loopback / IP / TCP 127.0.0.1:51245 > 127.0.0.1:51242 A / Raw
Loopback / IP / TCP 127.0.0.1:51245 > 127.0.0.1:51242 A / Raw
Loopback / IP / TCP 127.0.0.1:51242 > 127.0.0.1:51245 A
Loopback / IP / TCP 127.0.0.1:51242 > 127.0.0.1:51245 A / Raw
Loopback / IP / TCP 127.0.0.1:51242 > 127.0.0.1:51245 A / Raw
Loopback / IP / TCP 127.0.0.1:51245 > 127.0.0.1:51242 A
Loopback / IP / TCP 127.0.0.1:51245 > 127.0.0.1:51242 A
Loopback / IP / TCP 127.0.0.1:51243 > 127.0.0.1:51244 A / Raw
Loopback / IP / TCP 127.0.0.1:51243 > 127.0.0.1:51244 A / Raw
Loopback / IP / TCP 127.0.0.1:51244 > 127.0.0.1:51243 A
Loopback / IP / TCP 127.0.0.1:51244 > 127.0.0.1:51243 A
Loopback / IP / TCP 127.0.0.1:51244 > 127.0.0.1:51243 A / Raw
Loopback / IP / TCP 127.0.0.1:51244 > 127.0.0.1:51243 A / Raw
Loopback / IP / TCP 127.0.0.1:51243 > 127.0.0.1:51244 A
Loopback / IP / TCP 127.0.0.1:51243 > 127.0.0.1:51244 A
Loopback / IP / TCP 127.0.0.1:51242 > 127.0.0.1:51248 A / Raw
Loopback / IP / TCP 127.0.0.1:51242 > 127.0.0.1:51248 A / Raw
Loopback / IP / TCP 127.0.0.1:51248 > 127.0.0.1:51242 A
Loopback / IP / TCP 127.0.0.1:51248 > 127.0.0.1:51242 A
Loopback / IP / TCP 127.0.0.1:51248 > 127.0.0.1:51242 A / Raw
Loopback / IP / TCP 127.0.0.1:51248 > 127.0.0.1:51242 A / Raw
Loopback / IP / TCP 127.0.0.1:51242 > 127.0.0.1:51248 A
Loopback / IP / TCP 127.0.0.1:51242 > 127.0.0.1:51248 A
Loopback / IP / UDP 127.0.0.1:49217 > 127.0.0.1:17494 / Raw
Loopback / IP / UDP 127.0.0.1:49217 > 127.0.0.1:17494 / Raw
Loopback / IP / ICMP 127.0.0.1 > 127.0.0.1 dest-unreach port-unreachable / IPerror / UDPerror / Raw
Loopback / IP / TCP 127.0.0.1:51245 > 127.0.0.1:51242 A / Raw
Loopback / IP / TCP 127.0.0.1:51242 > 127.0.0.1:51245 A / Raw
Loopback / IP / TCP 127.0.0.1:51242 > 127.0.0.1:51245 A / Raw
Loopback / IP / TCP 127.0.0.1:51245 > 127.0.0.1:51242 A / Raw
Loopback / IP / TCP 127.0.0.1:51245 > 127.0.0.1:51242 A
Loopback / IP / TCP 127.0.0.1:51245 > 127.0.0.1:51242 A
Loopback / IP / TCP 127.0.0.1:51242 > 127.0.0.1:51245 A
Loopback / IP / TCP 127.0.0.1:51242 > 127.0.0.1:51245 A
Loopback / IP / TCP 127.0.0.1:51243 > 127.0.0.1:51244 A / Raw
Loopback / IP / TCP 127.0.0.1:51243 > 127.0.0.1:51244 A / Raw
Loopback / IP / TCP 127.0.0.1:51244 > 127.0.0.1:51243 A
Loopback / IP / TCP 127.0.0.1:51244 > 127.0.0.1:51243 A
Loopback / IP / TCP 127.0.0.1:51244 > 127.0.0.1:51243 A / Raw
Loopback / IP / TCP 127.0.0.1:51244 > 127.0.0.1:51243 A / Raw
Loopback / IP / TCP 127.0.0.1:51243 > 127.0.0.1:51244 A
Loopback / IP / TCP 127.0.0.1:51242 > 127.0.0.1:51248 A / Raw
Loopback / IP / TCP 127.0.0.1:51242 > 127.0.0.1:51248 A / Raw
Loopback / IP / TCP 127.0.0.1:51248 > 127.0.0.1:51242 A
Loopback / IP / TCP 127.0.0.1:51248 > 127.0.0.1:51242 A / Raw
Loopback / IP / TCP 127.0.0.1:51248 > 127.0.0.1:51242 A / Raw
Loopback / IP / TCP 127.0.0.1:51242 > 127.0.0.1:51248 A
Loopback / IP / TCP 127.0.0.1:51242 > 127.0.0.1:51248 A
Loopback / IP / TCP 127.0.0.1:51245 > 127.0.0.1:51242 A / Raw
Loopback / IP / TCP 127.0.0.1:51242 > 127.0.0.1:51245 A / Raw
Loopback / IP / TCP 127.0.0.1:51242 > 127.0.0.1:51245 A / Raw
Loopback / IP / TCP 127.0.0.1:51242 > 127.0.0.1:51245 A
Loopback / IP / TCP 127.0.0.1:51245 > 127.0.0.1:51242 A
Loopback / IP / TCP 127.0.0.1:51245 > 127.0.0.1:51242 A
Loopback / IP / TCP 127.0.0.1:51243 > 127.0.0.1:51244 A / Raw
Loopback / IP / TCP 127.0.0.1:51243 > 127.0.0.1:51244 A / Raw
Loopback / IP / TCP 127.0.0.1:51244 > 127.0.0.1:51243 A
Loopback / IP / TCP 127.0.0.1:51244 > 127.0.0.1:51243 A
Loopback / IP / TCP 127.0.0.1:51244 > 127.0.0.1:51243 A / Raw
Loopback / IP / TCP 127.0.0.1:51244 > 127.0.0.1:51243 A / Raw
Loopback / IP / TCP 127.0.0.1:51243 > 127.0.0.1:51244 A
Loopback / IP / TCP 127.0.0.1:51243 > 127.0.0.1:51244 A
Loopback / IP / TCP 127.0.0.1:51242 > 127.0.0.1:51248 A / Raw
Loopback / IP / TCP 127.0.0.1:51242 > 127.0.0.1:51248 A / Raw
Loopback / IP / TCP 127.0.0.1:51248 > 127.0.0.1:51242 A
Loopback / IP / TCP 127.0.0.1:51248 > 127.0.0.1:51242 A / Raw
Loopback / IP / TCP 127.0.0.1:51248 > 127.0.0.1:51242 A / Raw
Loopback / IP / TCP 127.0.0.1:51242 > 127.0.0.1:51248 A
Loopback / IP / TCP 127.0.0.1:51242 > 127.0.0.1:51248 A
Loopback / IP / UDP 127.0.0.1:49217 > 127.0.0.1:17494 / Raw
Loopback / IP / UDP 127.0.0.1:49217 > 127.0.0.1:17494 / Raw
Loopback / IP / ICMP 127.0.0.1 > 127.0.0.1 dest-unreach port-unreachable / IPerror / UDPerror / Raw
Loopback / IP / TCP 127.0.0.1:51245 > 127.0.0.1:51242 A / Raw
Loopback / IP / TCP 127.0.0.1:51242 > 127.0.0.1:51245 A / Raw
Loopback / IP / TCP 127.0.0.1:51245 > 127.0.0.1:51242 A / Raw
Loopback / IP / TCP 127.0.0.1:51242 > 127.0.0.1:51245 A / Raw
Loopback / IP / TCP 127.0.0.1:51245 > 127.0.0.1:51242 A
Loopback / IP / TCP 127.0.0.1:51245 > 127.0.0.1:51242 A
Loopback / IP / TCP 127.0.0.1:51242 > 127.0.0.1:51245 A
Loopback / IP / TCP 127.0.0.1:51243 > 127.0.0.1:51244 A / Raw
Loopback / IP / TCP 127.0.0.1:51243 > 127.0.0.1:51244 A / Raw
Loopback / IP / TCP 127.0.0.1:51244 > 127.0.0.1:51243 A
Loopback / IP / TCP 127.0.0.1:51244 > 127.0.0.1:51243 A
Loopback / IP / TCP 127.0.0.1:51244 > 127.0.0.1:51243 A / Raw
Loopback / IP / TCP 127.0.0.1:51244 > 127.0.0.1:51243 A / Raw
Loopback / IP / TCP 127.0.0.1:51243 > 127.0.0.1:51244 A
Loopback / IP / TCP 127.0.0.1:51243 > 127.0.0.1:51244 A
Loopback / IP / TCP 127.0.0.1:51242 > 127.0.0.1:51248 A / Raw
Loopback / IP / TCP 127.0.0.1:51242 > 127.0.0.1:51248 A / Raw
Loopback / IP / TCP 127.0.0.1:51248 > 127.0.0.1:51242 A
Loopback / IP / TCP 127.0.0.1:51248 > 127.0.0.1:51242 A / Raw
Loopback / IP / TCP 127.0.0.1:51248 > 127.0.0.1:51242 A / Raw
Loopback / IP / TCP 127.0.0.1:51242 > 127.0.0.1:51248 A
Loopback / IP / TCP 127.0.0.1:51242 > 127.0.0.1:51248 A
Loopback / IP / TCP 127.0.0.1:51242 > 127.0.0.1:51245 A / Raw
Loopback / IP / TCP 127.0.0.1:51245 > 127.0.0.1:51242 A / Raw
Loopback / IP / TCP 127.0.0.1:51242 > 127.0.0.1:51245 A / Raw
Loopback / IP / TCP 127.0.0.1:51245 > 127.0.0.1:51242 A / Raw
Loopback / IP / TCP 127.0.0.1:51242 > 127.0.0.1:51245 A
Loopback / IP / TCP 127.0.0.1:51242 > 127.0.0.1:51245 A
Loopback / IP / TCP 127.0.0.1:51245 > 127.0.0.1:51242 A
Loopback / IP / TCP 127.0.0.1:51245 > 127.0.0.1:51242 A
Loopback / IP / TCP 127.0.0.1:51243 > 127.0.0.1:51244 A / Raw
Loopback / IP / TCP 127.0.0.1:51243 > 127.0.0.1:51244 A / Raw
Loopback / IP / TCP 127.0.0.1:51244 > 127.0.0.1:51243 A
Loopback / IP / TCP 127.0.0.1:51244 > 127.0.0.1:51243 A
Loopback / IP / TCP 127.0.0.1:51244 > 127.0.0.1:51243 A / Raw
Loopback / IP / TCP 127.0.0.1:51244 > 127.0.0.1:51243 A / Raw
Loopback / IP / TCP 127.0.0.1:51243 > 127.0.0.1:51244 A
Loopback / IP / TCP 127.0.0.1:51243 > 127.0.0.1:51244 A
Loopback / IP / TCP 127.0.0.1:51242 > 127.0.0.1:51248 A / Raw
Loopback / IP / TCP 127.0.0.1:51242 > 127.0.0.1:51248 A / Raw
Loopback / IP / TCP 127.0.0.1:51248 > 127.0.0.1:51242 A
Loopback / IP / TCP 127.0.0.1:51248 > 127.0.0.1:51242 A
Loopback / IP / TCP 127.0.0.1:51248 > 127.0.0.1:51242 A / Raw
Loopback / IP / TCP 127.0.0.1:51248 > 127.0.0.1:51242 A / Raw
Loopback / IP / TCP 127.0.0.1:51242 > 127.0.0.1:51248 A
Loopback / IP / TCP 127.0.0.1:51242 > 127.0.0.1:51248 A
Loopback / IP / UDP 127.0.0.1:49217 > 127.0.0.1:17494 / Raw
Loopback / IP / UDP 127.0.0.1:49217 > 127.0.0.1:17494 / Raw
Loopback / IP / ICMP 127.0.0.1 > 127.0.0.1 dest-unreach port-unreachable / IPerror / UDPerror / Raw
Loopback / IP / TCP 127.0.0.1:51245 > 127.0.0.1:51242 A / Raw
Loopback / IP / TCP 127.0.0.1:51242 > 127.0.0.1:51245 A / Raw
